"Град","Код","Име","БЕЛ","МАТ","Уч. БЕЛ","Уч. МАТ"
"Варна","403531","Професионална гимназия по електротехника","3.81","4.16","105","87"
"Варна","403534","Професионална гимназия по туризъм Професор д-р Асен Златаров","4.25","4.74","175","22"
"Варна","400033","Спортно училище Георги Бенковски","3.69","4.78","69","12"
"Варна","400044","Професионална гимназия по икономика Д-р Иван Богоров","4.08","4.31","131","74"
"Варна","402172","Професионална гимназия по горско стопанство и дървообработване Николай Хайтов","3.31","2.81","48","5"
"Варна","400041","Трета природоматематическа гимназия Академик Методий Попов","4.94","4.96","134","134"
"Варна","400042","ІV Езикова гимназия Фредерик Жолио - Кюри","5.15","5.22","216","216"
"Варна","400043","Гимназия с преподаване на чужди езици Йоан Екзарх","5.40","5.32","180","180"
"Варна","400045","Първа езикова гимназия","5.58","5.63","227","227"
"Варна","400046","Математическа гимназия Д-р Петър Берон","5.37","5.43","202","202"
"Варна","400030","Седмо средно училище Найден Геров","4.02","4.40","47","49"
"Варна","400031","Средно училище с езиково обучение Ал. С. Пушкин","4.91","5.00","128","128"
"Варна","400034","Средно училище Гео Милев","4.09","4.44","19","19"
"Варна","400036","Средно училище Елин Пелин","3.33","3.54","10","10"
"Варна","400037","Средно училище Любен Каравелов","3.68","3.70","27","26"
"Варна","400039","Средно училище Пейо Крачолов Яворов","3.70","4.24","22","22"
"Варна","400040","Средно училище Свети Климент Охридски","4.28","4.73","49","49"
"Варна","400047","Средно училище за хуманитарни науки и изкуства Константин Преславски","4.63","4.68","207","206"
"Варна","403537","Средно училище Димчо Дебелянов","4.41","4.41","46","44"
"Варна","403538","Средно училище Неофит Бозвели","3.39","3.65","41","44"
"Варна","403564","Частно средно училище Монтесори Варна ООД","4.87","5.14","2","2"
"Варна","400070","Частна Търговска Гимназия Конто Трейд ЕООД","4.18","4.32","5","5"
"Варна","400074","Частна профилирана гимназия Антоан дьо Сент-Екзюпери","4.60","5.04","16","16"
"Варна","400076","Частна езикова гимназия с изучаване на чужди езици Джордж Байрон","4.14","4.49","11","11"
"Бургас","2902103","Национално училище за музикално и сценично изкуство Проф. Панчо Владигеров","4.49","4.54","51","31"
"Бургас","200247","Професионална гимназия по химични технологии Акад. Н. Д. Зелинский","3.68","3.70","125","60"
"Бургас","200250","Професионална техническа гимназия","3.15","3.67","18","1"
"Бургас","200240","Спортно училище Юрий Гагарин","3.59","3.92","45","10"
"Бургас","200242","Професионална гимназия по туризъм Проф. д-р Асен Златаров","3.99","4.40","148","42"
"Бургас","200243","Професионална гимназия по морско корабоплаване и риболов Свети Никола","3.25","0.00","23","0"
"Бургас","200244","Професионална гимназия по механоелектротехника и електроника","3.88","4.17","122","99"
"Бургас","200245","Професионална гимназия по строителство, архитектура и геодезия Кольо Фичето","4.16","4.23","154","148"
"Бургас","200246","Търговска гимназия","4.77","4.82","152","102"
"Бургас","200248","Професионална гимназия по електротехника и електроника Константин Фотинов","3.71","4.29","72","62"
"Бургас","200249","Професионална гимназия по транспорт","2.98","3.14","52","50"
"Бургас","200251","Професионална гимназия по дървообработване Георги Кондолов","3.24","3.19","14","13"
"Бургас","200252","Професионална гимназия по сградостроителство и инсталации Пеньо Пенев","2.96","2.92","20","22"
"Бургас","200235","Профилирана гимназия за романски езици Георги Стойков Раковски","4.89","5.13","178","179"
"Бургас","200236","Английска езикова гимназия Гео Милев","4.97","5.43","165","165"
"Бургас","200237","Немска езикова гимназия Гьоте","5.36","5.37","156","156"
"Бургас","200238","Профилирана гимназия за чужди езици Васил Левски","4.75","4.81","151","151"
"Бургас","200239","Профилирана природоматематическа гимназия Академик Никола Обрешков","5.29","5.51","153","153"
"Бургас","200221","Средно училище Христо Ботев","0.00","2.73","0","2"
"Бургас","200227","Средно училище Иван Вазов","3.21","3.38","16","17"
"Бургас","200228","Средно училище Йордан Йовков","3.26","3.22","8","8"
"Бургас","200229","Средно училище Епископ Константин Преславски","3.99","4.05","56","57"
"Бургас","200230","Средно училище Димчо Дебелянов","3.53","3.89","15","14"
"Бургас","200231","Средно училище Добри Чинтулов","3.42","3.60","20","19"
"Бургас","200232","Средно училище Константин Петканов","2.84","2.31","1","1"
"Бургас","200233","Средно училище Петко Росен","3.29","3.69","21","4"
"Бургас","200234","Средно училище Св. св. Кирил и Методий","3.74","4.35","88","90"
"Бургас","200255","Вечерно средно училище Захари Стоянов","3.28","3.49","47","46"
"Бургас","200258","Частна профилирана гимназия с изучаване на английски език Британика 1998","4.88","4.28","3","4"
"Благоевград","100280","Професионална гимназия по икономика Иван Илиев","4.46","4.56","130","47"
"Благоевград","100300","Професионална гимназия по строителство архитектура и геодезия Васил Левски","3.84","4.01","75","67"
"Благоевград","100052","Благоевградска професионална гимназия Ичко Бойчев","3.31","3.32","51","32"
"Благоевград","101730","Професионална гимназия по туризъм и лека промишленост Гоце Делчев","3.39","0.00","30","0"
"Благоевград","100190","Езикова гимназия Акад. Людмил Стоянов","5.24","5.40","158","158"
"Благоевград","100200","Природо-математическа гимназия Акад. Сергей Корольов","5.06","5.22","158","158"
"Благоевград","101870","Национална хуманитарна гимназияСв.св.Кирил и Методий","4.59","4.66","103","102"
"Благоевград","100070","Седмо средно училище Кузман Шапкарев","0.00","2.44","0","1"
"Благоевград","101250","Средно училище с изучаване на чужди езици Свети Климент Охридски","3.71","4.07","43","43"
"Благоевград","101880","Средно училище Иван Вазов","2.04","3.06","1","1"
"Благоевград","102060","Пето средно училище Георги Измирлиев","3.60","3.87","20","20"
"Велико Търново","300128","Професионална гимназия по строителство архитектура и геодезия Ангел Попов","4.06","4.56","86","19"
"Велико Търново","300129","Старопрестолна професионална гимназия по икономика","3.99","4.66","43","16"
"Велико Търново","300130","Професионална гимназия по електроника Александър Степанович Попов","3.46","3.80","31","31"
"Велико Търново","300131","Професионална гимназия по моден дизайн","3.59","0.00","6","0"
"Велико Търново","300132","Професионална гимназия по туризъм Д-р Васил Берон","3.88","3.89","93","38"
"Велико Търново","300121","Профилирана Хуманитарна гимназия Свети свети Кирил и Методий","3.52","0.00","12","0"
"Велико Търново","300122","Природо-математическа гимназия Васил Друмев","5.03","5.27","157","157"
"Велико Търново","300123","Профилирана езикова гимназия Проф. д-р Асен Златаров","4.99","5.20","152","153"
"Велико Търново","300143","Спортно училище Георги Живков","3.79","4.35","38","1"
"Велико Търново","300124","Средно училище Емилиян Станев","4.24","4.74","75","75"
"Велико Търново","300125","Средно училище Вела Благоева","3.97","4.60","18","19"
"Велико Търново","300126","Средно училище Владимир Комаров","3.14","3.24","1","3"
"Велико Търново","300141","Частна профилирана гимназия АК - Аркус ЕООД","5.25","5.34","23","23"
"Видин","500108","ПТГ Васил Левски","3.20","0.00","6","0"
"Видин","500110","ПГТ Михалаки Георгиев","3.58","3.79","63","5"
"Видин","502035","ПГ Проф. д-р Асен Златаров","4.22","3.99","76","58"
"Видин","500102","ППМГ Екзарх Антим I","4.56","4.60","76","75"
"Видин","503322","ГПЧЕ Йордан Радичков","4.75","5.28","85","85"
"Видин","503132","СУ Цар Симеон Велики","4.47","4.67","57","57"
"Видин","503241","СУ Св. св. Кирил и Методий","4.41","4.38","10","10"
"Видин","503242","СУ Петко Рачов Славейков","3.70","3.72","17","16"
"Враца","603140","Средно училище Мито Орозов","3.09","3.59","3","3"
"Враца","603065","Професионална техническа гимназия Н. Й. Вапцаров","3.49","4.01","59","17"
"Враца","603067","Професионална гимназия по търговия и ресторантьорство","3.48","3.55","68","14"
"Враца","603071","Професионална гимназия Димитраки Хаджитошин","3.36","3.66","15","13"
"Враца","600061","Профилирана езикова гимназия Йоан Екзарх","4.69","5.19","50","50"
"Враца","602062","Профилирана природо-математическа гимназия Академик Иван Ценов","5.01","5.13","151","151"
"Враца","608060","Спортно училище Св.Климент Охридски","3.42","3.84","37","34"
"Враца","600327","Средно училище Козма Тричков","4.02","4.48","50","48"
"Враца","603057","Средно училище Отец Паисий","4.18","4.20","26","26"
"Враца","603058","Средно училище Христо Ботев","4.68","5.20","74","74"
"Враца","603059","Средно училище Васил Кънчов","4.04","4.46","51","39"
"Враца","603070","Средно училище Никола Войводов","4.23","4.48","21","21"
"Габрово","700118","ПРОФЕСИОНАЛНА ТЕХНИЧЕСКА ГИМНАЗИЯ Д-р Никола Василиади","3.83","4.24","112","91"
"Габрово","700120","Професионална гимназия по туризъм Пенчо Семов","3.79","4.23","87","43"
"Габрово","700115","НАЦИОНАЛНА АПРИЛОВСКА ГИМНАЗИЯ","5.05","5.25","126","126"
"Габрово","700116","Природоматематическа гимназия Академик Иван Гюзелев","4.97","5.14","102","102"
"Габрово","700113","Средно училище Отец Паисий","3.43","3.69","22","20"
"Габрово","700114","Средно училище Райчо Каролев","3.46","3.69","23","22"
"Добрич","800021","Професионална гимназия по техника и строителство Михаил Василиевич Ломоносов","3.24","3.07","10","2"
"Добрич","800023","Финансово-стопанска гимназия Васил Левски","4.20","4.53","77","36"
"Добрич","800028","Професионална гимназия по туризъм П. К. Яворов","3.49","0.00","82","0"
"Добрич","800328","Професионална гимназия по транспорт обслужване и лека промишленост","3.00","2.62","54","1"
"Добрич","800022","Професионална гимназия по ветеринарна медицина Проф. д-р Георги Павлов","3.84","3.95","23","23"
"Добрич","800026","Професионална гимназия по аграрно стопанство","3.25","2.97","32","1"
"Добрич","800019","Природоматематическа гимназия Иван Вазов","4.47","4.88","74","74"
"Добрич","800020","Езикова гимназия Гео Милев","5.11","5.26","128","129"
"Добрич","800012","Спортно училище Георги Стойков Раковски","3.25","3.54","19","2"
"Добрич","800013","Средно училище Димитър Талев","4.18","4.53","42","42"
"Добрич","800015","Средно училище Свети Климент Охридски","4.90","4.82","42","42"
"Добрич","800016","Средно училище Любен Каравелов","3.61","4.12","19","19"
"Добрич","800017","Средно училище Петко Рачов Славейков","4.19","4.81","23","21"
"Добрич","800018","Средно училище Свети свети Кирил и Методий","4.48","4.98","25","25"
"Добрич","800325","Сдружение Частна профилирана гимназия по туризъм и предприемачество Райко Цончев","5.15","5.26","8","8"
"Добрич","800326","Частно средно училище с профилирана подготовка по чужди езици и математика Леонардо да Винчи","4.76","4.94","6","6"
"Кърджали","909108","Професионална гимназия по икономика Алеко Константинов","3.99","4.19","117","11"
"Кърджали","909109","Професионална гимназия по туризъм Проф. д-р Асен Златаров","3.09","4.41","59","1"
"Кърджали","909110","Професионална гимназия Васил Левски","3.00","0.00","8","0"
"Кърджали","909111","Професионална гимназия по облекло и дизайн Евридика","2.69","0.00","6","0"
"Кърджали","909112","Професионална гимназия по електротехника и електроника Капитан Петко войвода","3.38","3.59","40","43"
"Кърджали","909114","Професионална гимназия по строителство Христо Смирненски","3.12","2.90","21","10"
"Кърджали","909113","Професионална гимназия по селско и горско стопанство","2.85","2.79","32","3"
"Кърджали","909107","Езикова гимназия Христо Ботев","5.03","4.92","176","176"
"Кърджали","909101","Средно училище Владимир Димитров - Майстора","3.08","0.00","1","0"
"Кърджали","909103","Средно училище Йордан Йовков","3.33","3.76","29","27"
"Кърджали","909105","Средно училище Отец Паисий с природоматематическа насоченост","4.09","4.48","75","74"
"Кърджали","909106","Средно училище Петко Рачов Славейков","4.94","5.05","78","78"
"Кюстендил","1001360","Професионална техническа гимназия Джон Атанасов","2.96","3.11","19","14"
"Кюстендил","1001380","Професионална гимназия по икономика и мениджмънт Йордан Захариев","3.84","3.92","88","82"
"Кюстендил","1001420","Професионална гимназия по туризъм Никола Йонков Вапцаров","3.48","3.61","28","29"
"Кюстендил","1001670","Професионална гимназия по лека промишленост Владимир Димитров-Майстора","2.67","3.06","9","2"
"Кюстендил","1000002","Професионална гимназия по селско стопанствоСв.Климент Охридски","2.92","2.94","5","2"
"Кюстендил","1000540","Езикова гимназия Д-р Петър Берон","4.50","4.95","57","57"
"Кюстендил","1000550","Природоматематическа гимназия Проф. Емануил Иванов","4.76","5.08","95","95"
"Кюстендил","1001390","Спортно училище Васил Левски","2.98","3.20","21","1"
"Ловеч","1100324","Средно училище Димитър Митев","3.00","2.95","2","1"
"Ловеч","1100322","Професионална гимназия по механоелектротехника","3.51","3.76","41","23"
"Ловеч","1100329","Национална професионална гимназия по ветеринарна медицина Проф. д-р Димитър Димов","3.67","3.98","55","16"
"Ловеч","1100331","Професионална гимназия по икономика търговия и услуги","3.73","3.29","36","36"
"Ловеч","1100320","Профилирана природо-математическа гимназия","4.34","4.50","101","102"
"Ловеч","1100328","Профилирана езикова гимназия Екзарх Йосиф I","5.29","5.19","178","178"
"Ловеч","1100316","Средно училище Тодор Кирков","3.51","3.99","21","22"
"Ловеч","1100318","Средно училище Свети Климент Охридски","3.86","4.20","11","12"
"Монтана","1201021","Финансово-стопанска професионална гимназия Васил Левски","4.24","4.41","94","20"
"Монтана","1201022","Професионална гимназия по строителство, архитектура и компютърни науки Проф. Арх. Стефан Стефанов","3.74","3.93","104","23"
"Монтана","1201023","Професионална гимназия по лека промишленост","3.04","3.41","20","2"
"Монтана","1201033","Професионална гимназия по техника и електротехника Христо Ботев","3.44","3.33","48","36"
"Монтана","1201001","Природо-математическа профилирана гимназия Св. Климент Охридски","4.49","4.95","101","101"
"Монтана","1201002","Профилирана гимназия с преподаване на чужди езици Петър Богдан","4.59","4.80","80","80"
"Монтана","1201004","Второ средно училище Никола Йонков Вапцаров","3.66","3.56","14","14"
"Монтана","1201011","Седмо средно училище Йордан Радичков","3.22","3.47","18","17"
"Монтана","1201034","Шесто средно училище Отец Паисий","3.23","3.46","7","8"
"Пазарджик","1301139","Професионална гимназия по икономика и мениджмънт","4.32","4.09","151","103"
"Пазарджик","1302769","Професионална гимназия по механоелектротехника","3.50","3.60","106","40"
"Пазарджик","1302961","Професионална гимназия по химични и хранителни технологии","3.06","2.66","65","1"
"Пазарджик","1303006","ПРОФЕСИОНАЛНА ГИМНАЗИЯ ПО ПРОМИШЛЕНИ ТЕХНОЛОГИИ","2.95","3.48","15","1"
"Пазарджик","1303344","Професионална гимназия по фризьорство и ресторантьорство-гр.Пазарджик","2.97","0.00","14","0"
"Пазарджик","1304332","Професионална гимназия по строителство и архитектура","3.34","3.05","35","15"
"Пазарджик","1301911","ПРОФЕСИОНАЛНА ГИМНАЗИЯ ПО СЕЛСКО СТОПАНСТВО ЦАРИЦА ЙОАННА","2.97","3.10","55","2"
"Пазарджик","1302580","Профилирана гимназия Иван Сергеевич Аксаков","3.83","4.14","24","23"
"Пазарджик","1304290","Езикова гимназия Бертолт Брехт","5.12","5.16","227","227"
"Пазарджик","1309018","ПРОФИЛИРАНА МАТЕМАТИЧЕСКА ГИМНАЗИЯ Константин Величков","4.74","4.76","119","98"
"Пазарджик","1301234","Средно училище Димитър Гачев","0.00","0.00","0","0"
"Пазарджик","1304948","Средно училище Георги Бенковски","3.70","3.73","39","39"
"Пазарджик","1305338","Средно училище Георги Брегов","3.43","3.73","22","20"
"Пазарджик","1305831","Средно училище Д-р Петър Берон","3.66","4.16","21","20"
"Перник","1403233","Професионална гимназия по енергетика и минна промишленост Христо Ботев","3.34","3.61","44","45"
"Перник","1403234","Професионална гимназия по техника и строителство Арх. Йордан Миланов","3.78","4.20","91","60"
"Перник","1403235","Технологична професионална гимназия Мария Кюри","3.43","3.66","26","26"
"Перник","1403236","Професионална гимназия по икономика","4.03","4.37","104","83"
"Перник","1403237","Професионална гимназия по облекло и туризъм Свети Иван Рилски","3.36","3.66","36","20"
"Перник","1403219","Природоматематическа гимназия Христо Смирненски","4.37","4.94","73","73"
"Перник","1403220","Гимназия с преподаване на чужди езици Симеон Радев","5.00","5.17","142","142"
"Перник","1403217","Спортно училище Олимпиец","3.23","3.61","16","12"
"Перник","1403213","Пето средно училище Петко Рачов Славейков","3.29","3.54","13","13"
"Перник","1403214","VI Средно училище Свети Свети Кирил и Методий ","3.71","3.89","8","8"
"Перник","1403216","Средно училище с разширено изучаване на чужди езици Д-р Петър Берон","4.59","4.98","21","21"
"Плевен","2902107","НАЦИОНАЛНО УЧИЛИЩЕ ПО ИЗКУСТВАТА ПАНАЙОТ ПИПКОВ","4.30","4.30","49","24"
"Плевен","1500141","Професионална гимназия по механоелектротехника","3.53","4.41","52","13"
"Плевен","1500144","Професионална гимназия по строителство архитектура и геодезия Никола Фичев","3.58","3.77","12","9"
"Плевен","1500145","Професионална гимназия по транспорт Проф. Цветан Лазаров","3.12","2.88","30","7"
"Плевен","1500147","Професионална гимназия по облекло и текстил Христо Бояджиев","3.01","4.01","15","1"
