"Град","Код","Име","БЕЛ","МАТ","Уч. БЕЛ","Уч. МАТ"
"София","2201400","Професионална гимназия по туризъм Алеко Константинов","3.71","4.38","91","9"
"София","2201078","78. Средно училище Христо Смирненски","3.83","4.28","19","18"
"София","2215170","170 Средно училище Васил Левски","4.13","4.34","38","38"
"София","2211557","Духовно Училище Софийска духовна семинария Св. Иван Рилски","4.03","4.67","9","9"
"София","2203603","Специално училище за ученици с нарушено зрение ЛУИ БРАЙЛ","5.31","4.58","3","3"
"София","2202612","Специално училище за ученици с увреден слух Проф. д-р Дечо Денев","2.35","0.00","4","0"
"София","2902101","Национално музикално училище Любомир Пипков","4.74","5.07","62","32"
"София","2902301","Национално училище за танцово изкуство","4.45","0.00","65","0"
"София","2902401","Национално училище за изящни изкуства Илия Петров","4.64","4.03","53","5"
"София","2902501","НАЦИОНАЛНА ГИМНАЗИЯ ЗА ПРИЛОЖНИ ИЗКУСТВА СВЕТИ ЛУКА - СОФИЯ","4.52","4.95","98","38"
"София","2902601","Национална професионална гимназия по полиграфия и фотография","4.57","3.14","135","1"
"София","2902701","Национален учебен комплекс по култура с лицей за изучаване на италиански език и култура с участието на Република Италия","5.17","5.22","50","50"
"София","2902702","Национална гимназия за древни езици и култури Константин Кирил Философ","5.36","5.24","70","70"
"София","2202401","Професионална гимназия по екология и биотехнологии Проф. д-р Асен Златаров","4.21","4.09","50","36"
"София","2204402","НАЦИОНАЛНА ПРОФЕСИОНАЛНА ГИМНАЗИЯ ПО ПРЕЦИЗНА ТЕХНИКА И ОПТИКА М. В. Ломоносов","4.42","4.65","181","166"
"София","2204403","ПРОФЕСИОНАЛНА ГИМНАЗИЯ ПО ТЕКСТИЛНИ И КОЖЕНИ ИЗДЕЛИЯ","3.08","3.26","13","2"
"София","2204405","ПРОФЕСИОНАЛНА ГИМНАЗИЯ ПО ПОДЕМНА, СТРОИТЕЛНА И ТРАНСПОРТНА ТЕХНИКА","3.18","3.82","32","8"
"София","2205407","СОФИЙСКА ПРОФЕСИОНАЛНА ГИМНАЗИЯ по ЕЛЕКТРОНИКА Джон Атанасов","4.58","4.67","225","223"
"София","2205408","Софийска професионална гимназия Княгиня Евдокия","3.45","3.81","39","3"
"София","2206409","Професионална гимназия по транспорт и енергетика Хенри Форд","3.60","3.87","126","72"
"София","2206410","ПРОФЕСИОНАЛНА ГИМНАЗИЯ ПО АУДИО-, ВИДЕО- И ТЕЛЕКОМУНИКАЦИЯ А. С. ПОПОВ","3.79","4.12","123","77"
"София","2207412","ПРОФЕСИОНАЛНА ГИМНАЗИЯ ПО ТРАНСПОРТ","3.36","3.67","41","35"
"София","2208413","Софийска гимназия по хлебни и сладкарски технологии","3.35","3.44","27","23"
"София","2211417","Професионална гимназия по облекло Княгиня Мария Луиза","4.02","3.62","42","9"
"София","2211419","СОФИЙСКА ГИМНАЗИЯ ПО СТРОИТЕЛСТВО, АРХИТЕКТУРА И ГЕОДЕЗИЯ ХРИСТО БОТЕВ","4.94","4.79","178","168"
"София","2211420","НАЦИОНАЛНА ФИНАНСОВО-СТОПАНСКА ГИМНАЗИЯ","4.85","4.94","207","150"
"София","2213350","Технологично училище Електронни системи към Технически Университет - София","5.11","5.22","92","91"
"София","2216422","Професионална гимназия по механоелектротехника Н.Й.Вапцаров","3.47","3.87","46","46"
"София","2216423","СОФИЙСКА ПРОФЕСИОНАЛНА ГИМНАЗИЯ ПО ТУРИЗЪМ","4.22","4.70","174","39"
"София","2217424","ПРОФЕСИОНАЛНА ГИМНАЗИЯ ПО ЕЛЕКТРОТЕХНИКА И АВТОМАТИКА","4.09","4.52","132","75"
"София","2221430","ПРОФЕСИОНАЛНА ГИМНАЗИЯ ПО ТРАНСПОРТ МАКГАХАН","3.54","3.68","52","48"
"София","2223431","ПРОФЕСИОНАЛНА ГИМНАЗИЯ ПО ТЕЛЕКОМУНИКАЦИИ","4.25","4.67","181","165"
"София","2224432","Професионална гимназия по дизайн Елисавета Вазова","4.19","4.82","50","5"
"София","2224433","НАЦИОНАЛНА ТЪРГОВСКО - БАНКОВА ГИМНАЗИЯ","4.87","4.85","256","70"
"София","2204311","Профилирана гимназия с интензивно изучаване на румънски език МИХАЙ ЕМИНЕСКУ","4.72","4.82","26","26"
"София","2211304","Национална природо-математическа гимназия Академик Любомир Чакалов","5.17","5.40","237","238"
"София","2213307","СПОРТНО УЧИЛИЩЕ ГЕН. ВЛАДИМИР СТОЙЧЕВ","3.77","4.12","99","53"
"София","2204134","134. средно училище Димчо Дебелянов","4.84","5.37","78","78"
"София","2217151","НАЦИОНАЛНО СРЕДНО УЧИЛИЩЕ СОФИЯ","3.70","4.27","29","29"
"София","2206411","Професионална гимназия по хранително-вкусови технологии Проф. д-р Георги Павлов","3.56","3.92","60","20"
"София","2217426","ПРОФЕСИОНАЛНА ГИМНАЗИЯ ПО СЕЛСКО СТОПАНСТВО БУЗЕМА","3.12","3.67","13","2"
"София","2204091","91.НЕМСКА ЕЗИКОВА ГИМНАЗИЯ Професор Константин Гълъбов","5.63","5.63","187","167"
"София","2206302","Втора английска езикова гимназия Томас Джеферсън","5.31","5.52","201","201"
"София","2209305","203 Профилирана езикова гимназия Свети Методий","4.05","4.30","20","21"
"София","2212303","33. Езикова гимназия Света София","4.67","4.93","57","57"
"София","2216164","164. гимназия с преподаване на испански език Мигел де Сервантес","5.62","5.67","149","149"
"София","2216301","Първа английска езикова гимназия","5.36","5.61","210","210"
"София","2216306","Софийска математическа гимназия Паисий Хилендарски","5.42","5.68","169","169"
"София","2216309","IV Сменно-вечерна гимназия Отец Паисий ","3.76","3.91","96","97"
"София","2220308","Профилирана гимназия за изобразителни изкуства Професор Николай Райнов","4.34","4.18","29","2"
"София","2221157","157 Гимназия с изучаване на чужд език Сесар Вайехо","4.88","4.87","95","95"
"София","2222009","9 Френска езикова гимназия Алфонс дьо Ламартин","5.26","5.22","202","203"
"София","2208057","57 Спортно училище Свети Наум Охридски","3.50","4.03","75","18"
"София","2214153","153 Спортно училище Неофит Рилски","3.40","3.69","50","6"
"София","2219166","166 Спортно училище Васил Левски","3.69","4.29","91","9"
"София","2202002","2 Средно училище Академик Емилиян Станев ","4.45","4.82","94","95"
"София","2202026","26 Средно училище Йордан Йовков","4.02","4.24","12","13"
"София","2203074","74 СУ ГОЦЕ ДЕЛЧЕВ","3.76","3.88","30","29"
"София","2203140","140. СРЕДНО УЧИЛИЩЕ ИВАН БОГОРОВ","3.56","3.74","30","28"
"София","2204018","18 Средно училище Уилям Гладстон","5.05","5.13","217","217"
"София","2204030","30 СРЕДНО УЧИЛИЩЕ БРАТЯ МИЛАДИНОВИ","4.78","4.83","60","61"
"София","2204032","32. СРЕДНО УЧИЛИЩЕ С ИЗУЧАВАНЕ НА ЧУЖДИ ЕЗИЦИ СВЕТИ КЛИМЕНТ ОХРИДСКИ","5.25","5.56","162","162"
"София","2204310","5. Вечерно средно училище Пеньо Пенев","3.87","4.10","24","25"
"София","2205105","105. СРЕДНО УЧИЛИЩЕ АТАНАС ДАЛЧЕВ","4.23","4.41","63","63"
"София","2205119","119 Средно училище Академик Михаил Арнаудов","4.58","4.87","93","93"
"София","2206003","3. СУ Марин Дринов","3.41","3.93","27","25"
"София","2206113","113 СУ САВА ФИЛАРЕТОВ","3.16","2.99","6","6"
"София","2207068","68. Средно училище Академик Никола Обрешков","3.43","3.46","18","18"
"София","2207108","108 Средно училище Никола Беловеждов","3.89","4.06","18","18"
"София","2208028","28 Средно училище Алеко Константинов","3.60","3.83","17","19"
"София","2208123","123 Средно училищe Стефан Стамболов","3.26","3.26","16","17"
"София","2208135","135 средно училище Ян Амос Коменски","4.14","4.23","19","18"
"София","2209019","19 СРЕДНО УЧИЛИЩЕ ЕЛИН ПЕЛИН","4.57","4.82","71","71"
"София","2209036","36 Средно училище Максим Горки","4.08","4.37","33","33"
"София","2209051","51 СРЕДНО УЧИЛИЩЕ ЕЛИСАВЕТА БАГРЯНА","4.58","4.97","91","90"
"София","2209132","132. Средно училище Ваня Войнова","3.95","4.24","62","63"
"София","2210085","85 Средно училище Отец Паисий","3.33","3.65","22","18"
"София","2210117","117. СУ","3.58","3.84","22","21"
"София","2211021","21 СРЕДНО УЧИЛИЩЕ ХРИСТО БОТЕВ","4.60","4.97","45","44"
"София","2211035","35. СРЕДНО ЕЗИКОВО УЧИЛИЩЕ ДОБРИ ВОЙНИКОВ","5.31","4.97","121","121"
"София","2212037","37. Средно училище Райна Княгиня","3.11","3.33","14","14"
"София","2212040","40 Средно училище Луи Пастьор","4.03","3.94","13","13"
"София","2212056","56. Средно училище Професор Константин Иречек","4.61","4.76","26","25"
"София","2212079","79 средно училище Индира Ганди","4.11","4.38","25","25"
"София","2212090","90 Средно училище Генерал Хосе де Сан Мартин","3.99","3.85","14","14"
"София","2212096","96 Средно училище Лев Николаевич Толстой","4.31","4.35","45","46"
"София","2212097","97 Средно училище Братя Миладинови","3.76","4.38","38","38"
"София","2212137","137 средно училище Ангел Кънчев","4.39","4.85","42","42"
"София","2213010","10 Средно училище Теодор Траянов ","3.76","3.86","15","14"
"София","2213039","39 Средно училище Петър Динеков","3.64","3.39","1","1"
"София","2213081","81. Средно училище Виктор Юго","4.33","4.53","43","44"
"София","2213118","118 Средно училище Академик Людмил Стоянов","4.01","4.59","24","24"
"София","2213128","128 СРЕДНО УЧИЛИЩЕ АЛБЕРТ АЙНЩАЙН","4.02","4.34","50","51"
"София","2213131","131. СУ Климент Аркадиевич Тимирязев","3.90","4.02","19","17"
"София","2213144","144 Средно училище Народни будители","4.10","4.23","67","68"
"София","2214015","15 Средно училище Адам Мицкевич","3.43","3.54","14","15"
"София","2214054","54. СРЕДНО УЧИЛИЩЕ Свети ИВАН РИЛСКИ","4.28","4.53","79","79"
"София","2214101","101. СРЕДНО УЧИЛИЩЕ БАЧО КИРО","3.93","4.33","41","41"
"София","2216001","1 Средно училище Пенчо П. Славейков","4.36","4.64","87","86"
"София","2217066","66 Средно училище Филип Станиславов","3.31","3.31","16","17"
"София","2217088","88. Средно училище Димитър Попниколов","3.97","4.45","36","36"
"София","2217149","149 Средно училище ,,Иван Хаджийски","3.42","3.35","19","20"
"София","2219024","24 Средно училище П.К.Яворов","3.21","3.18","19","17"
"София","2219044","44. Средно училище Неофит Бозвели","4.51","4.54","18","18"
"София","2219095","95 СУ Проф. Иван Шишманов","4.01","4.36","49","49"
"София","2219130","130. средно училище Стефан Караджа","3.41","3.58","13","13"
"София","2220029","29. Средно училище Кузман Шапкарев","3.54","3.68","33","35"
"София","2221023","23 Средно училище Фредерик Жолио-Кюри","4.08","4.38","76","76"
"София","2221031","31 Средно училище за чужди езици и математика Иван Вазов","5.12","5.23","151","151"
"София","2221093","93-то Средно училище Александър Теодоров - Балан","3.69","3.96","18","18"
"София","2221094","94 СРЕДНО УЧИЛИЩЕ Димитър Страшимиров","3.24","3.52","33","23"
"София","2221138","138. СРЕДНО УЧИЛИЩЕ ЗА ЗАПАДНИ И ИЗТОЧНИ ЕЗИЦИ ПРОФ. ВАСИЛ ЗЛАТАРСКИ","4.37","4.43","103","104"
"София","2222007","7. СРЕДНО УЧИЛИЩЕ СВ. СЕДМОЧИСЛЕНИЦИ","4.60","4.97","130","121"
"София","2222012","12 Средно училище Цар Иван Асен II","4.55","4.73","68","67"
"София","2222127","127 СРЕДНО УЧИЛИЩЕ Иван Николаевич Денкоглу","4.74","4.84","131","131"
"София","2222133","133 Средно училище „Александър Сергеевич Пушкин”","5.25","5.22","105","105"
"София","2224022","22 Средно езиково училище Георги Стойков Раковски","5.17","5.25","161","161"
"София","2224047","47 Средно училище Христо Груев Данов","3.67","3.95","32","35"
"София","2224073","73.СУ с преподаване на чужди езици Владислав Граматик","5.58","5.24","153","153"
"София","2224121","121 СРЕДНО УЧИЛИЩЕ ГЕОРГИ ИЗМИРЛИЕВ","3.49","4.01","18","17"
"София","2208539","Частна професионална гимназия по икономика, туризъм и информатика,,Булпрогрес","3.66","0.00","12","0"
"София","2211517","ЧАСТНА ПРОФЕСИОНАЛНА ГИМНАЗИЯ БАНКЕР","4.63","0.00","12","0"
"София","2204511","Частна профилирана гимназия с чуждоезиково обучение Езиков свят","4.63","4.96","14","14"
"София","2205520","Частна езикова гимназия Проф.Иван Апостолов","5.14","5.67","38","38"
"София","2212540","ЧАСТНА НЕМСКА ГИМНАЗИЯ ЕРИХ КЕСТНЕР","5.10","5.33","15","15"
"София","2213503","Частна профилирана гимназия с чуждоезиково обучение Меридиан 22","5.04","5.46","24","24"
"София","2213507","АМЕРИКАНСКИ КОЛЕЖ В СОФИЯ","5.52","5.67","161","162"
"София","2216533","Първа частна английска гимназия Уилям Шекспир-Интелект Инвест","4.37","5.06","28","28"
"София","2221563","Първа Частна Математическа Гимназия","5.45","5.78","14","14"
"София","2221590","Частна профилирана гимназия Образователни технологии","4.44","4.89","39","39"
"София","2223547","ЧАСТНА ЕЗИКОВА ГИМНАЗИЯ ПРОФ.Д-Р В.ЗЛАТАРСКИ","4.91","5.54","41","41"
"София","2201515","Частно средно училище Цар Симеон Велики","5.21","5.27","6","6"
"София","2202534","Частно профилирано средно училище Свети Наум","3.73","3.26","3","3"
"София","2202535","ЧСУ Рьорих с ранно чуждоезиково обучение и разширено изучаване на музика и изобразително изкуство","4.06","4.41","5","5"
"София","2202536","Частно средно езиково училище Британика","4.74","4.78","13","13"
"София","2202574","Частно средно училище Свети Георги","4.45","5.86","3","3"
"София","2203720","Частно средно училище Дружба - София","4.48","4.87","30","30"
"София","2204549","Частно средно училище с немски език Веда","5.15","5.42","11","11"
"София","2208526","Частно средно училище Орфей","4.13","4.75","4","4"
"София","2209529","Частно езиково средно училище Дорис Тенеди","5.15","5.44","27","27"
"София","2216532","Частно средно училище УВЕКИНД","4.83","5.63","12","12"
"София","2218192","192. СРЕДНО УЧИЛИЩЕ ХРИСТО БОТЕВ","3.48","4.22","12","12"
"София","2218606","Средно училище Св. Иван Рилски","3.57","3.42","2","2"
"София","2218071","71 Средно училище Пейо Яворов","3.50","3.86","21","19"
"Пловдив","1690187","ДУ-Пловдивска духовна семинария Св. Св. Кирил и Методий-Пловдив","3.80","3.45","9","10"
"Пловдив","1690271","Специално училище за ученици с увреден слух Проф. Д-р Ст. Белинов","3.31","0.00","1","0"
"Пловдив","2902102","Национално училище за музикално и танцово изкуство Добрин Петков","4.57","4.37","26","2"
"Пловдив","2902302","Национална гимназия за сценични и екранни изкуства","4.08","3.39","36","3"
"Пловдив","2902402","Национална художествена гимназия Цанко Лавренов","4.39","0.00","59","0"
"Пловдив","1690174","Професионална гимназия по електротехника и електроника","4.31","4.44","202","180"
"Пловдив","1690175","Национална търговска гимназия - Пловдив","5.08","5.14","215","120"
"Пловдив","1690176","Професионална гимназия по облекло Ана Май","3.81","3.75","47","12"
"Пловдив","1690178","Професионална гимназия по туризъм Проф. д-р Асен Златаров","4.04","4.04","146","45"
"Пловдив","1690179","Професионална гимназия по битова техника","3.65","4.03","81","70"
"Пловдив","1690272","Професионална гимназия по архитектура строителство и геодезия Арх.Камен Петков","4.25","4.20","190","166"
"Пловдив","1690273","Професионална гимназия по транспорт и строителни технологии Гоце Делчев","3.20","3.33","77","75"
"Пловдив","1690473","Професионална гимназия по кожени изделия и текстил Д-р Иван Богоров","3.47","3.52","14","10"
"Пловдив","1690572","Професионална гимназия по механотехника Професор Цветан Лазаров","3.65","4.00","93","47"
"Пловдив","1690573","Професионална гимназия по машиностроене","3.05","3.01","21","4"
"Пловдив","1690347","Спортно училище Васил Левски","3.74","4.92","70","10"
"Пловдив","1690177","Професионална гимназия по вътрешна архитектура и дървообработване Христо Ботев","3.53","3.79","24","8"
"Пловдив","1690472","Професионална гимназия по хранителни технологии и техника","4.02","3.80","130","34"
"Пловдив","1690153","Хуманитарна гимназия Св. Св. Кирил и Методий","5.08","5.12","181","181"
"Пловдив","1690346","Математическа гимназия Академик Кирил Попов","5.18","5.17","212","209"
"Пловдив","1690449","Езикова гимназия Пловдив","5.34","5.47","270","270"
"Пловдив","1690450","Езикова гимназия Иван Вазов","5.30","5.18","235","235"
"Пловдив","1690451","Френска езикова гимназия Антоан дьо Сент - Екзюпери","4.74","4.92","200","198"
"Пловдив","1690150","Средно училище Любен Каравелов","4.27","3.96","18","18"
"Пловдив","1690154","Средно училище СВ. ПАИСИЙ ХИЛЕНДАРСКИ ","4.45","4.62","102","101"
"Пловдив","1690155","Средно училище Свети Климент Охридски","4.20","4.26","75","73"
"Пловдив","1690156","Средно училище Свети Патриарх Евтимий","4.64","4.69","114","114"
"Пловдив","1690157","Средно училище Цар Симеон Велики","3.56","4.01","23","23"
"Пловдив","1690247","Средно училище Найден Геров","3.19","3.40","20","17"
"Пловдив","1690345","Средно училище Свети свети Кирил и Методий","3.70","3.95","33","33"
"Пловдив","1690446","Средно училище Никола Вапцаров","3.56","3.70","18","18"
"Пловдив","1690447","Средно училище Пейо Крачолов Яворов","3.86","4.15","73","72"
"Пловдив","1690448","Средно училище Христо Груев Данов","3.72","3.84","14","15"
"Пловдив","1690542","Средно училище Братя Миладинови","3.45","3.48","26","25"
"Пловдив","1690549","Средно училище Константин Величков ","3.93","3.95","16","17"
"Пловдив","1690550","Средно училище Свети Константин - Кирил Философ","3.79","4.14","21","23"
"Пловдив","1690642","Средно училище Димитър Матевски","3.71","3.95","21","23"
"Пловдив","1690643","Средно училище Свети Седмочисленици","3.52","3.83","20","20"
"Пловдив","1690644","Средно училище Свети Софроний Врачански","4.44","4.32","16","17"
"Пловдив","1690645","СРЕДНО УЧИЛИЩЕ ЧЕРНОРИЗЕЦ ХРАБЪР","4.23","4.61","36","36"
"Пловдив","1690910","Частна професионална гимназия по икономика и управление","3.69","4.49","7","3"
"Пловдив","1690904","Частна профилирана гимназия Класик","4.25","4.41","17","19"
"Пловдив","1690909","Частна езикова гимназия Стоян Сариев","4.39","4.92","11","11"
"Пловдив","1690901","ЧАСТНО СРЕДНО УЧИЛИЩЕ ДРУЖБА","4.52","4.51","11","11"
"Варна","2902106","НАЦИОНАЛНО УЧИЛИЩЕ ПО ИЗКУСТВАТА ДОБРИ ХРИСТОВ","4.27","4.51","63","18"
"Варна","400055","Професионална техническа гимназия","3.67","4.02","139","18"
"Варна","400058","Професионална гимназия по химични и хранително-вкусови технологии Дм.Ив.Менделеев","3.52","3.67","23","23"
"Варна","400063","Професионална гимназия по строителство архитектура и геодезия Васил Левски","3.57","3.67","48","20"
"Варна","402030","Варненска търговска гимназия Георги Стойков Раковски","4.57","4.51","134","100"
"Варна","402161","Професионална гимназия по текстил и моден дизайн","3.51","3.89","24","9"
"Варна","402183","Варненска морска гимназия Свети Николай Чудотворец","3.75","4.09","35","15"
